{
  "$schema": "ef-core-compatibility.schema.json",
  "manifestVersion": 1,
  "provider": "CSharpDB.EntityFrameworkCore",
  "efCoreVersion": "10.0.10",
  "tiers": {
    "tier1": "Common application patterns that form the primary production support target.",
    "tier2": "Advanced patterns that are supported when explicitly listed.",
    "tier3": "Experimental, planned, or explicitly unsupported behavior."
  },
  "features": [
    {
      "id": "runtime.file-backed",
      "category": "Runtime and connections",
      "name": "File-backed embedded databases",
      "status": "Supported",
      "tier": "tier1",
      "summary": "UseCSharpDb supports direct embedded file-backed databases.",
      "proofTests": ["EnsureCreated_FileBackedCrudAndTypeRoundTrip_Succeeds"]
    },
    {
      "id": "runtime.private-memory",
      "category": "Runtime and connections",
      "name": "Private in-memory databases",
      "status": "Supported",
      "tier": "tier1",
      "summary": "A private :memory: database is supported while its supplied connection remains open.",
      "proofTests": ["UseCSharpDb_WithPrivateMemoryConnection_SupportsRuntimeOperations"]
    },
    {
      "id": "runtime.remote-and-pooling",
      "category": "Runtime and connections",
      "name": "Remote transports, pooling, and named shared memory",
      "status": "Unsupported",
      "tier": "tier3",
      "summary": "The provider rejects endpoint, non-direct, pooled, and named shared-memory configurations.",
      "proofTests": ["ProviderValidation_RejectsUnsupportedConnectionConfigurations"]
    },
    {
      "id": "model.composite-primary-keys",
      "category": "Model features",
      "name": "Composite primary keys and indexes",
      "status": "Supported",
      "tier": "tier1",
      "summary": "Composite primary keys and ordered composite indexes are supported.",
      "proofTests": ["CompositeKeyEntity_SupportsCrudIndexesAndDuplicateRejection"]
    },
    {
      "id": "model.foreign-keys",
      "category": "Model features",
      "name": "Foreign keys",
      "status": "Partial",
      "tier": "tier1",
      "summary": "Named scalar and composite foreign keys support create, standalone add/drop, primary or alternate-key targets, and cascade or restrictive delete behavior. EF Core's default ClientSetNull behavior is qualified for optional scalar and composite relationships: tracked dependents have nullable FK components cleared before principal deletion, while untracked dependents remain protected by a restrictive database constraint. Database-side SetNull remains unsupported.",
      "proofTests": [
        "MigrationsSqlGenerator_StandaloneForeignKey_CanBeAddedAndDropped",
        "MigrationsSqlGenerator_StandaloneCompositeForeignKey_CanBeAddedAndDropped",
        "OptionalRelationship_DefaultClientSetNull_EmitsRestrictiveForeignKeySql",
        "MigrationsSqlGenerator_CreateTable_PreservesForeignAndUniqueConstraintNames",
        "MigrationsSqlGenerator_AddConstraints_RejectsInvalidExistingDataWithoutPersistingMetadata",
        "AlternateKeyRelationship_SupportsEnsureCreatedAndEnforcement",
        "CompositeForeignKeyRelationship_SupportsEnsureCreatedAndEnforcement",
        "OptionalRelationship_DefaultClientSetNull_NullsTrackedDependentBeforePrincipalDelete",
        "OptionalRelationship_DefaultClientSetNull_UntrackedDependentKeepsDatabaseProtection",
        "OptionalCompositeRelationship_DefaultClientSetNull_NullsNullableForeignKeyProperty",
        "OptionalRelationship_ClientSetNull_MatchesTrackedAndUntrackedDelete",
        "ClientSetNull_RejectsForeignKeysWithNonNullableDependentProperties",
        "DatabaseSetNull_RemainsExplicitlyUnsupported",
        "MigrationsSqlGenerator_EmitsCompositeForeignKeysAndStandalonePrimaryKeyChanges"
      ]
    },
    {
      "id": "model.alternate-keys",
      "category": "Model features",
      "name": "Alternate keys and unique constraints",
      "status": "Supported",
      "tier": "tier1",
      "summary": "Single and composite alternate keys are created as named unique constraints and support standalone add/drop migrations.",
      "proofTests": [
        "MigrationsSqlGenerator_StandaloneUniqueConstraint_CanBeAddedAndDropped",
        "MigrationsSqlGenerator_CreateTable_PreservesForeignAndUniqueConstraintNames",
        "AlternateKeyRelationship_SupportsEnsureCreatedAndEnforcement"
      ]
    },
    {
      "id": "model.literal-defaults",
      "category": "Model features",
      "name": "Literal column defaults",
      "status": "Partial",
      "tier": "tier1",
      "summary": "Literal INTEGER, REAL, TEXT, BLOB, and NULL defaults are supported; DefaultValueSql is not.",
      "proofTests": ["LiteralDefaultsAndCreateTableChecks_AreApplied", "MigrationsSqlGenerator_EmitsLiteralDefaultAndCreateTableCheck"]
    },
    {
      "id": "model.check-constraints",
      "category": "Model features",
      "name": "Check constraints",
      "status": "Partial",
      "tier": "tier1",
      "summary": "Create-table checks and standalone add/drop migrations are supported for deterministic row-local expressions accepted by the engine.",
      "proofTests": [
        "LiteralDefaultsAndCreateTableChecks_AreApplied",
        "MigrationsSqlGenerator_EmitsLiteralDefaultAndCreateTableCheck",
        "MigrationsSqlGenerator_StandaloneCheckConstraint_CanBeAddedAndDropped"
      ]
    },
    {
      "id": "model.computed-columns",
      "category": "Model features",
      "name": "Computed columns",
      "status": "Planned",
      "tier": "tier3",
      "summary": "Computed column metadata is rejected pending engine and catalog support.",
      "proofTests": []
    },
    {
      "id": "types.core",
      "category": "Data types",
      "name": "Core CLR type mappings",
      "status": "Supported",
      "tier": "tier1",
      "summary": "Boolean, integral, enum, floating-point, string, GUID, temporal, and byte-array values round-trip.",
      "proofTests": ["EnsureCreated_FileBackedCrudAndTypeRoundTrip_Succeeds"]
    },
    {
      "id": "types.decimal",
      "category": "Data types",
      "name": "Exact decimal mapping",
      "status": "Partial",
      "tier": "tier1",
      "summary": "Decimal and nullable decimal use provider-owned scaled INTEGER storage without an application converter. The default is decimal(18,2); precision 1-18 and scale 0-precision support exact round trips, parameters used with one facet mapping, comparisons, ordering, and ordinary indexes. Excess fractional digits and overflow are rejected rather than rounded. Keys, defaults, generated values, custom store types, computed decimal expressions (including arithmetic, numeric casts, conditionals/coalescing, and aggregates), decimal collection/subquery Contains, cross-facet parameter reuse, comparisons with application-converter decimal mappings, model-mapped decimal functions, and precision/scale-changing migrations remain unsupported and fail explicitly. Complex properties are rejected until flattened mappings are qualified.",
      "proofTests": [
        "DecimalScaledIntegerMapping_RoundTripsAndSupportsParametersComparisonsAndOrdering",
        "DecimalScaledIntegerMapping_RejectsLossyAndOverflowingValues",
        "DecimalModelValidation_RejectsUnsupportedFacetsDefaultsAndKeys",
        "UnsupportedDecimalExpressions_ReportBeforeCommandDispatch",
        "MigrationsSqlGenerator_DecimalScaleChange_RemainsExplicitlyRejected"
      ]
    },
    {
      "id": "migrations.ensure-created",
      "category": "Migrations and DDL",
      "name": "EnsureCreated",
      "status": "Supported",
      "tier": "tier1",
      "summary": "EnsureCreated supports file-backed and private in-memory databases.",
      "proofTests": ["EnsureCreated_FileBackedCrudAndTypeRoundTrip_Succeeds", "UseCSharpDb_WithPrivateMemoryConnection_SupportsRuntimeOperations"]
    },
    {
      "id": "migrations.database-migrate",
      "category": "Migrations and DDL",
      "name": "Database.Migrate and migration history",
      "status": "Supported",
      "tier": "tier1",
      "summary": "Compiled migrations apply to file-backed databases and can be safely rerun.",
      "proofTests": ["DatabaseMigrate_AppliesCompiledMigrations_AndCanBeReRun"]
    },
    {
      "id": "migrations.scripts",
      "category": "Migrations and DDL",
      "name": "Non-idempotent migration scripts",
      "status": "Supported",
      "tier": "tier1",
      "summary": "IMigrator generates executable SQL for the supported migration operation set.",
      "proofTests": ["Migrator_GenerateScript_ProducesSupportedSql"]
    },
    {
      "id": "migrations.idempotent-scripts",
      "category": "Migrations and DDL",
      "name": "Idempotent migration scripts",
      "status": "Supported",
      "tier": "tier1",
      "summary": "Conditional migration-history blocks can be generated and rerun against empty, partial, and current databases.",
      "proofTests": [
        "Migrator_GenerateIdempotentScript_ProducesConditionalMigrationBlocks",
        "Migrator_GenerateIdempotentScript_CanRunRepeatedlyFromEmptyDatabase",
        "Migrator_GenerateIdempotentScript_AppliesOnlyMissingMigration"
      ]
    },
    {
      "id": "migrations.primary-key-alterations",
      "category": "Migrations and DDL",
      "name": "Standalone primary-key migrations",
      "status": "Partial",
      "tier": "tier1",
      "summary": "Named single-TEXT and composite INTEGER/TEXT logical primary keys support standalone add/drop migrations. A physical single-INTEGER primary key can also be added to populated data: validated non-NULL unique values become the physical row IDs while ready ordinary/unique SQL, constraint-owned, and foreign-key-support indexes are rebuilt atomically. Full-text, collection, and non-ready indexes remain unsupported. EF drops require the exact constraint name, raw ALTER TABLE DROP PRIMARY KEY remains available for legacy unnamed keys, and dropping a key preserves NOT NULL.",